------------------------------------------------------------------------------------------------------
UC5-->Delete contact with using person name
------------------------------------------------------------------------------------------------------

mysql> select * from address_book;
+-----------+----------+---------+--------+------------+--------------------+---------+--------------+
| firstName | lastName | address | city   | state      | email              | zipCode | phone_number |
+-----------+----------+---------+--------+------------+--------------------+---------+--------------+
| Sri       | Bhargav  | Mumbai  | Mumbai | Maharastra | Bharagav@gmail.com |  556856 |    123456788 |
| Srav      | Sunny    | Mncl    | Mncl   | Telanagana | sunny@gmail.com    |  556845 |    123456456 |
| Sravan    | Kumar    | Gdk     | Gdk    | Goa        | kumar@gmail.com    | 5567654 |    123455647 |
+-----------+----------+---------+--------+------------+--------------------+---------+--------------+
3 rows in set (0.14 sec)

mysql> delete from address_book where firstName='Sravan';
Query OK, 1 row affected (0.27 sec)

mysql> select * from address_book;
+-----------+----------+---------+--------+------------+--------------------+---------+--------------+
| firstName | lastName | address | city   | state      | email              | zipCode | phone_number |
+-----------+----------+---------+--------+------------+--------------------+---------+--------------+
| Sri       | Bhargav  | Mumbai  | Mumbai | Maharastra | Bharagav@gmail.com |  556856 |    123456788 |
| Srav      | Sunny    | Mncl    | Mncl   | Telanagana | sunny@gmail.com    |  556845 |    123456456 |
+-----------+----------+---------+--------+------------+--------------------+---------+--------------+
2 rows in set (0.00 sec)